{
  "schema_version": "scars-canonical-results-2.0",
  "evidence_type": "synthetic_dev",
  "run": {
    "run_id": "SCHEMA-DEMO-NOT-A-RESULT",
    "created_at": null,
    "status": "schema_demo_only",
    "elapsed_sec": null,
    "command": null,
    "device": null,
    "seeds": [
      11,
      23,
      37,
      53,
      71
    ]
  },
  "provenance": {
    "git_commit": null,
    "code_archive_sha256": null,
    "dataset_checksums": null,
    "source_role_manifests": null,
    "transform_hash": null,
    "teacher_hashes": null,
    "calibration_hash": null,
    "relation_cache_hash": null,
    "student_hash": null,
    "environment": null,
    "hardware_power_manifest": null,
    "target_access_ledger": null,
    "artifact_manifest": null
  },
  "datasets": {
    "domains": [
      "DroneRFa",
      "DroneRFb-DIR",
      "DRFF-R2"
    ],
    "ontology": null,
    "acquisition_gate": null
  },
  "splits": {
    "folds": [
      {
        "fold_id": "held_domain=DroneRFa",
        "source_domains": [
          "DroneRFb-DIR",
          "DRFF-R2"
        ],
        "held_domain": "DroneRFa",
        "split_before_windowing": true,
        "group_axes": null,
        "recording_ids": null,
        "manifest_hash": null
      },
      {
        "fold_id": "held_domain=DroneRFb-DIR",
        "source_domains": [
          "DroneRFa",
          "DRFF-R2"
        ],
        "held_domain": "DroneRFb-DIR",
        "split_before_windowing": true,
        "group_axes": null,
        "recording_ids": null,
        "manifest_hash": null
      },
      {
        "fold_id": "held_domain=DRFF-R2",
        "source_domains": [
          "DroneRFa",
          "DroneRFb-DIR"
        ],
        "held_domain": "DRFF-R2",
        "split_before_windowing": true,
        "group_axes": null,
        "recording_ids": null,
        "manifest_hash": null
      }
    ],
    "manifest_hash": null
  },
  "source_fitting": {
    "folds": [
      {
        "fold_id": "held_domain=DroneRFa",
        "normalization_state": null,
        "cyclic_frequency_set": null,
        "teacher_relation": null,
        "pareto_state": null,
        "source_only_audit": null
      },
      {
        "fold_id": "held_domain=DroneRFb-DIR",
        "normalization_state": null,
        "cyclic_frequency_set": null,
        "teacher_relation": null,
        "pareto_state": null,
        "source_only_audit": null
      },
      {
        "fold_id": "held_domain=DRFF-R2",
        "normalization_state": null,
        "cyclic_frequency_set": null,
        "teacher_relation": null,
        "pareto_state": null,
        "source_only_audit": null
      }
    ]
  },
  "representations": {
    "configuration_order": null,
    "records": {
      "W": null,
      "C": null,
      "E": null,
      "S": null,
      "tensor_contract": {
        "dtype": "float32",
        "shape": [
          4,
          16,
          16
        ],
        "bytes": 4096,
        "channel_order": [
          "W",
          "C",
          "E",
          "S"
        ],
        "scope": "nominal full-family pre-selection tensor"
      }
    }
  },
  "source_selection": {
    "policy": "source-only Pareto selection without scalarization",
    "folds": [
      {
        "fold_id": "held_domain=DroneRFa",
        "candidate_records": null,
        "pareto_front": null,
        "selected_configuration": null,
        "selection_audit": null
      },
      {
        "fold_id": "held_domain=DroneRFb-DIR",
        "candidate_records": null,
        "pareto_front": null,
        "selected_configuration": null,
        "selection_audit": null
      },
      {
        "fold_id": "held_domain=DRFF-R2",
        "candidate_records": null,
        "pareto_front": null,
        "selected_configuration": null,
        "selection_audit": null
      }
    ]
  },
  "static_metadata": {
    "status": "computed_without_real_iq_or_training",
    "empirical_evidence": false,
    "generated_from": {
      "project": "scars-uav-rf",
      "config_sha256": {
        "representation.yaml": "68a6cd921ff4c3bc65c904954b6dc3378ad26bfd0e26402e80de9d4b9400ec08",
        "experiments.yaml": "cb42a5b4b6d38e21934f32b2c0c3652edcc67e9f38c2c267fb93ade9858182e9",
        "baselines.yaml": "dd624e1c0c3b0f8540284496e385959f44f7d7a827515a5461303248fc20725e",
        "nuisance_grid.yaml": "f6fa71bb738d7bad43f0612f5eb5f509053af32654d491776d333c4a1f945b27"
      },
      "source_sha256": {
        "src/scars/cli/collect_static_metadata.py": "1be3ad9efffc14f0d1ad3efed5f7761533ed983ad8857de2da26ff8862be05e0",
        "src/scars/evaluation/costs.py": "f2ef1b0eff572b23b6c9de1295fdd6fc2f9d6bf852cab8a16f56779f5caceff5",
        "src/scars/models/baselines.py": "47954b7e0ddf570d148a419bd99886fef48e0a9b05087f45d06298121a72c107",
        "src/scars/models/scars_net.py": "9d3fe55e5e225e2649a2a01aa6dcb915d5a0bd45a1d13f4d89437382d1bd4d02",
        "src/scars/representations/scattering.py": "3e88ceff4aa7dc40d76b6f56e57716b319c63fcdeec7a169c213f8dbe13f1749",
        "src/scars/representations/tensor.py": "8425f42a581fdc198bb54906eb85ec9eaf5ba4b6883266bf366c788f4d45bc6f",
        "src/scars/baselines/registry.py": "eb2349435c6871882c3e122408977ac464f4285646e72fa1ca375bb46580505d",
        "src/scars/results/registry.py": "02951d76af4f553d268799dd5bae2c04a20477ac88d5a6fb7e54cfa7f6819b79",
        "src/scars/results/schema.py": "e50f636f1d25719c8413d022d3aaea71b4bb802bcb588336dfdddb565b041910",
        "src/scars/results/validator.py": "754fe1eb9b32c956cd04f8d611e7afed64e1638ff6b3cadbb7e2099c24382a46",
        "src/scars/cli/finalize_results.py": "af34d17a5e9e6d98b56f70d63cb95aa2ef421d019f2d99212c00ce12c7144202"
      },
      "collector_environment": {
        "python": "3.11.7",
        "implementation": "CPython",
        "numpy": "1.26.4",
        "torch": "2.5.1",
        "pyyaml": "6.0.1",
        "platform": "darwin"
      }
    },
    "registry_counts": {
      "candidate_datasets": 3,
      "recognition_conditions": 15,
      "neural_conditions": 13,
      "ablation_conditions": 30,
      "required_seeds": 5,
      "candidate_held_domain_folds": 3,
      "nominal_neural_fold_seed_runs": 195,
      "nominal_recognition_fold_seed_cells": 213,
      "ablation_fold_seed_cells": null,
      "ablation_fold_seed_formula": "sum_d (26 + 5 A_d) = 78 + 5 sum_d A_d for three eligible folds",
      "scope_note": "Nominal three-fold recognition count follows the runtime seed contract: five seeds for 14 conditions and one deterministic fixed-wavelet row. The ablation count remains symbolic because A_d is selected independently per fold; 26 representation ablations run once per fold and each active-family deletion runs five seeds. Actual eligible folds and A_d remain null until preflight/source freeze."
    },
    "protocol": {
      "candidate_datasets": [
        "DroneRFa",
        "DroneRFb-DIR",
        "DRFF-R2"
      ],
      "required_seeds": [
        11,
        23,
        37,
        53,
        71
      ],
      "window_samples": 4096,
      "window_hop_samples": 2048,
      "window_overlap_samples": 2048,
      "window_overlap_fraction": 0.5,
      "input_complex_dtype": "complex64",
      "input_window_bytes": 32768,
      "group_split_before_windowing": true,
      "registered_resamples": 10000,
      "latency_warmups": 20,
      "latency_repeats": 100,
      "source_only_tuning": true,
      "target_tuning": "forbidden"
    },
    "representation": {
      "stored_dtype": "float32",
      "bytes_per_value": 4,
      "family_order": [
        "W",
        "C",
        "E",
        "S"
      ],
      "candidate_resolutions": [
        8,
        16,
        32
      ],
      "primary_resolution": 16,
      "tensor_profiles": [
        {
          "resolution": 8,
          "full_family_shape": [
            4,
            8,
            8
          ],
          "bytes_per_family": 256,
          "full_tensor_bytes": 1024,
          "active_tensor_bytes_formula": "256 A",
          "active_family_symbol": "A"
        },
        {
          "resolution": 16,
          "full_family_shape": [
            4,
            16,
            16
          ],
          "bytes_per_family": 1024,
          "full_tensor_bytes": 4096,
          "active_tensor_bytes_formula": "1024 A",
          "active_family_symbol": "A"
        },
        {
          "resolution": 32,
          "full_family_shape": [
            4,
            32,
            32
          ],
          "bytes_per_family": 4096,
          "full_tensor_bytes": 16384,
          "active_tensor_bytes_formula": "4096 A",
          "active_family_symbol": "A"
        }
      ],
      "nominal_full_tensor_shape": [
        4,
        16,
        16
      ],
      "nominal_full_tensor_bytes": 4096,
      "frame_samples": 128,
      "frame_hop_samples": 32,
      "frames_per_window": 125,
      "native_stft_shape": [
        128,
        125
      ],
      "native_energy_shape": [
        125,
        2
      ],
      "nominal_native_cyclic_shape": [
        8,
        128
      ],
      "nominal_cyclic_count": 8,
      "cyclic_count_sweep": [
        4,
        8,
        16
      ],
      "cyclic_frequency_values": null,
      "cyclic_frequency_reason_null": "Source-fitted from eligible source recordings.",
      "wst_nominal": {
        "J": 4,
        "Q": 2
      },
      "wst_path_profiles": [
        {
          "J": 3,
          "Q": 1,
          "order1_paths": 3,
          "order2_paths": 3,
          "total_paths": 6
        },
        {
          "J": 3,
          "Q": 2,
          "order1_paths": 6,
          "order2_paths": 6,
          "total_paths": 12
        },
        {
          "J": 3,
          "Q": 4,
          "order1_paths": 12,
          "order2_paths": 12,
          "total_paths": 24
        },
        {
          "J": 4,
          "Q": 1,
          "order1_paths": 4,
          "order2_paths": 6,
          "total_paths": 10
        },
        {
          "J": 4,